{
  "schema_version": "1.0.0",
  "run": {
    "run_id": "run_sample_full_001",
    "mode": "roadmap",
    "status": "completed",
    "created_at": "2026-03-13T15:49:16.166369Z",
    "updated_at": "2026-03-13T15:49:16.166369Z",
    "planner_version": "1.1.0",
    "response_language": "ja"
  },
  "problem_definition": {
    "problem_id": "pb_agent_contract",
    "title": "AIエージェント構築フローをMVP化する",
    "statement": "ローカル文書を読み、validate と run を区別しながら段階的に計画を返せるAIエージェントを、小規模チームでも実装できる形にしたい。",
    "scope": "『AIエージェント構築フローをMVP化する』のMVP を対象に、3件の制約と3件の資産を前提とした設計・検証計画を作る。",
    "non_goals": [
      "長期run storeの設計",
      "マルチテナント認証",
      "本番運用の全面自動化"
    ],
    "derived_from": [
      "in_scope",
      "in_contract",
      "in_examples",
      "co_schedule",
      "co_team",
      "ev_brief"
    ]
  },
  "success_criteria": [
    {
      "criterion_id": "sc_01",
      "statement": "AIエージェント構築フローをMVP化する のMVPスコープとI/F契約が固定されている。",
      "verification_method": "仕様レビューとschema validation",
      "priority": 1
    },
    {
      "criterion_id": "sc_02",
      "statement": "同期MVPとして動くCLI / HTTP / MCP と、再現可能なサンプル入出力一式を揃える。 に直結する最小実装と検証手順が用意されている。",
      "verification_method": "プロトタイプ実行と受け入れ確認",
      "priority": 2
    },
    {
      "criterion_id": "sc_03",
      "statement": "次アクション・リスク・フォールバックが運用できる粒度で整理されている。",
      "verification_method": "Runbook と Evaluation のレビュー",
      "priority": 3
    }
  ],
  "hypotheses": [
    {
      "hypothesis_id": "hy_01",
      "statement": "『課題発見とロードマップ生成を混ぜると、次アクションが抽象化しやすい。』を設計判断へ反映すると、AIエージェント構築フローをMVP化する の実装着手が早くなる。",
      "why_this_might_work": "与えられた insight が制約と整合しており、初期フェーズで検証しやすいため。",
      "priority": 1,
      "related_insight_ids": [
        "in_scope"
      ],
      "related_constraint_ids": [
        "co_schedule",
        "co_team"
      ],
      "status": "open"
    },
    {
      "hypothesis_id": "hy_02",
      "statement": "『validate と run の返却契約を分けると、実装と説明が安定する。』を設計判断へ反映すると、AIエージェント構築フローをMVP化する の実装着手が早くなる。",
      "why_this_might_work": "与えられた insight が制約と整合しており、初期フェーズで検証しやすいため。",
      "priority": 2,
      "related_insight_ids": [
        "in_contract"
      ],
      "related_constraint_ids": [
        "co_schedule",
        "co_team"
      ],
      "status": "open"
    },
    {
      "hypothesis_id": "hy_03",
      "statement": "『良いサンプル入出力があると、AIエージェントの使い方と完成形を共有しやすい。』を設計判断へ反映すると、AIエージェント構築フローをMVP化する の実装着手が早くなる。",
      "why_this_might_work": "与えられた insight が制約と整合しており、初期フェーズで検証しやすいため。",
      "priority": 3,
      "related_insight_ids": [
        "in_examples"
      ],
      "related_constraint_ids": [
        "co_schedule",
        "co_team"
      ],
      "status": "open"
    }
  ],
  "solution_options": [
    {
      "option_id": "op_01",
      "title": "薄いMVPから始める",
      "summary": "コアユースケース、契約、評価ループを先に固定してから拡張する。",
      "addresses_hypothesis_ids": [
        "hy_01",
        "hy_02"
      ],
      "tradeoffs": [
        "初期スコープの切り方が甘いと後で再設計が発生する",
        "周辺機能は後回しになる"
      ],
      "recommended": true
    },
    {
      "option_id": "op_02",
      "title": "基盤を先に固める",
      "summary": "評価基盤、監視、拡張性を先に整えてからユースケースを載せる。",
      "addresses_hypothesis_ids": [
        "hy_01",
        "hy_02",
        "hy_03"
      ],
      "tradeoffs": [
        "初期成果が見えにくい",
        "基盤過剰設計のリスクがある"
      ],
      "recommended": false
    }
  ],
  "experiment_plan": [
    {
      "experiment_id": "exp_01",
      "title": "仮説1の検証",
      "goal": "hy_01 が MVP 計画に有効か確認する。",
      "verifies_hypothesis_ids": [
        "hy_01"
      ],
      "method": "小さなプロトタイプ、仕様レビュー、成功条件の照合を行う。",
      "success_condition": "主要な成功条件に対して実施可能な手順と成果物が定義される。",
      "failure_signal": "必要な前提が不足し、次フェーズに進む判断ができない。",
      "depends_on": [],
      "estimated_effort": "0.5d"
    },
    {
      "experiment_id": "exp_02",
      "title": "仮説2の検証",
      "goal": "hy_02 が MVP 計画に有効か確認する。",
      "verifies_hypothesis_ids": [
        "hy_02"
      ],
      "method": "小さなプロトタイプ、仕様レビュー、成功条件の照合を行う。",
      "success_condition": "主要な成功条件に対して実施可能な手順と成果物が定義される。",
      "failure_signal": "必要な前提が不足し、次フェーズに進む判断ができない。",
      "depends_on": [
        "exp_01"
      ],
      "estimated_effort": "1d"
    }
  ],
  "roadmap": [
    {
      "phase_id": "ph_01",
      "order": 1,
      "title": "課題定義と契約固定",
      "goal": "AIエージェント構築フローをMVP化する のMVP境界と成功条件を固定する。",
      "exit_criteria": [
        "problem brief が合意されている",
        "schema と評価条件が揃っている"
      ],
      "tasks": [
        {
          "task_id": "tk_01",
          "title": "対象ユーザーとゴールを固定する",
          "description": "AIエージェント構築フローをMVP化する の一次利用者、入力、期待結果を1ページにまとめる。",
          "deliverable": "problem brief",
          "depends_on": []
        },
        {
          "task_id": "tk_02",
          "title": "契約と評価指標を定義する",
          "description": "request / response / validation-result のI/Fと受け入れ条件を固定する。",
          "deliverable": "schema set and evaluation checklist",
          "depends_on": [
            "tk_01"
          ]
        },
        {
          "task_id": "tk_03",
          "title": "最小エージェントループを設計する",
          "description": "planner、tool call、memory、fallback の最小ループを図と文章で整理する。",
          "deliverable": "MVP architecture draft",
          "depends_on": [
            "tk_02"
          ]
        }
      ]
    },
    {
      "phase_id": "ph_02",
      "order": 2,
      "title": "コア実装と検証",
      "goal": "最小エージェントループを実装し、主要仮説を検証する。",
      "exit_criteria": [
        "主要シナリオで動作する",
        "failure / fallback の扱いが確認できる"
      ],
      "tasks": [
        {
          "task_id": "tk_04",
          "title": "コアフローを実装する",
          "description": "入力正規化、計画生成、validate を一貫したCLI/HTTP/MCPで動かす。",
          "deliverable": "working prototype",
          "depends_on": [
            "tk_03"
          ]
        },
        {
          "task_id": "tk_05",
          "title": "ガードレールと失敗系を実装する",
          "description": "invalid input、broad problem、fallback の扱いを明確にする。",
          "deliverable": "error and fallback behaviors",
          "depends_on": [
            "tk_04"
          ]
        },
        {
          "task_id": "tk_06",
          "title": "代表シナリオで評価する",
          "description": "AIエージェント構築のサンプル要求で、出力の妥当性と次アクションの粒度を確認する。",
          "deliverable": "evaluation report",
          "depends_on": [
            "tk_05"
          ]
        }
      ]
    },
    {
      "phase_id": "ph_03",
      "order": 3,
      "title": "運用整理と拡張準備",
      "goal": "運用文書、サンプル、次フェーズ候補を整理する。",
      "exit_criteria": [
        "再実行できるサンプルが残っている",
        "次の優先拡張が決まっている"
      ],
      "tasks": [
        {
          "task_id": "tk_07",
          "title": "運用文書とサンプルを整理する",
          "description": "README、Runbook、サンプル入出力、Task Seed を実装と整合させる。",
          "deliverable": "updated docs and examples",
          "depends_on": [
            "tk_06"
          ]
        },
        {
          "task_id": "tk_08",
          "title": "次の拡張候補を決める",
          "description": "memory、tool routing、observability のどれを次に進めるか優先順位を付ける。",
          "deliverable": "prioritized backlog",
          "depends_on": [
            "tk_07"
          ]
        }
      ]
    }
  ],
  "risks": [
    {
      "risk_id": "rk_01",
      "statement": "制約『2週間以内に最小版を動かしたい。』が実装順を圧迫する可能性がある。",
      "severity": "high",
      "mitigation": "早い段階でスコープを固定し、受け入れ条件を先に確認する。"
    },
    {
      "risk_id": "rk_02",
      "statement": "制約『少人数で保守できる薄いwrapper構成を維持したい。』が実装順を圧迫する可能性がある。",
      "severity": "medium",
      "mitigation": "早い段階でスコープを固定し、受け入れ条件を先に確認する。"
    },
    {
      "risk_id": "rk_03",
      "statement": "既知失敗『契約を後回しにすると wrapper 間のズレ修正が増える。』が再発する恐れがある。",
      "severity": "high",
      "mitigation": "failure の再発条件をテストとガードレールに落とし込む。"
    }
  ],
  "fallback_options": [
    {
      "fallback_id": "fb_01",
      "trigger": "主要仮説の検証が失敗したとき",
      "statement": "薄いMVPへ戻し、要件を削って再計画する。",
      "tradeoff": "短期的な機能量は減るが、再現性と学習速度は上がる。"
    }
  ],
  "next_actions": [
    {
      "action_id": "na_01",
      "title": "対象ユーザーとゴールを固定する",
      "description": "AIエージェント構築フローをMVP化する の一次利用者、入力、期待結果を1ページにまとめる。",
      "deliverable": "problem brief",
      "depends_on": []
    },
    {
      "action_id": "na_02",
      "title": "契約と評価指標を定義する",
      "description": "request / response / validation-result のI/Fと受け入れ条件を固定する。",
      "deliverable": "schema set and evaluation checklist",
      "depends_on": [
        "na_01"
      ]
    },
    {
      "action_id": "na_03",
      "title": "最小エージェントループを設計する",
      "description": "planner、tool call、memory、fallback の最小ループを図と文章で整理する。",
      "deliverable": "MVP architecture draft",
      "depends_on": [
        "na_02"
      ]
    }
  ],
  "open_questions": [],
  "assumptions": [
    "初回は deterministic planner で十分",
    "memory や tool routing は次フェーズで拡張する"
  ],
  "failures": [],
  "confidence": {
    "score": 0.8,
    "reason": "入力された insight・constraint・asset の粒度が十分で、MVP の段階計画へ分解できるため。"
  }
}